[
  {
    "id": "aq-sibo-yt-001",
    "paraphrase": "If antibiotics reduced my symptoms once, why did bloating return months later?",
    "theme": "sibo",
    "source_type": "youtube_comment",
    "source_ref": "https://www.youtube.com/watch?v=UxQ48n_k28Q",
    "status": "clustered",
    "cluster_id": "sibo-relapse",
    "asset_coverage": ["pathway", "kit", "ap", "infographic"],
    "priority": "high",
    "notes": "Voice layer on relapse after kill-only care. Video: Why SIBO Recurs (educational long-form).",
    "collected_at": "2026-09-04"
  },
  {
    "id": "aq-sibo-yt-002",
    "paraphrase": "Does a glucose breath test miss distal small-bowel overgrowth?",
    "theme": "sibo",
    "source_type": "youtube_comment",
    "source_ref": "https://www.youtube.com/watch?v=ObENBjKGm3g",
    "status": "clustered",
    "cluster_id": "sibo-breath-test",
    "asset_coverage": ["pathway", "kit"],
    "priority": "high",
    "notes": "Clarifying ask after Siebecker SIBO–IBS testing discussion.",
    "collected_at": "2026-09-04"
  },
  {
    "id": "aq-sibo-yt-003",
    "paraphrase": "Is methane overgrowth (IMO) managed the same way as hydrogen SIBO?",
    "theme": "sibo",
    "source_type": "youtube_comment",
    "source_ref": "https://www.youtube.com/watch?v=SQPwHIzULfQ",
    "status": "clustered",
    "cluster_id": "sibo-basics",
    "asset_coverage": ["pathway", "gap"],
    "priority": "low",
    "notes": "Pimentel/IMO educational video; BDL assets thin — mark gap for later leaf.",
    "collected_at": "2026-09-04"
  },
  {
    "id": "aq-sibo-yt-004",
    "paraphrase": "If killing bacteria is not enough, what else should be on the plan after antimicrobials?",
    "theme": "sibo",
    "source_type": "youtube_comment",
    "source_ref": "https://www.youtube.com/watch?v=WCKjvs5Atc8",
    "status": "clustered",
    "cluster_id": "sibo-relapse",
    "asset_coverage": ["pathway", "kit", "ap"],
    "priority": "high",
    "notes": "Maps cleanly to Phase 2 secretions/motility + Phase 3 nutrients; prefer long-form companion when filming.",
    "collected_at": "2026-09-04"
  },
  {
    "id": "aq-sibo-yt-005",
    "paraphrase": "Should I stay on a strict low-FODMAP diet for months after SIBO treatment?",
    "theme": "sibo",
    "source_type": "youtube_comment",
    "source_ref": "https://www.youtube.com/watch?v=ObENBjKGm3g",
    "status": "clustered",
    "cluster_id": "sibo-diet",
    "asset_coverage": ["pathway", "kit"],
    "priority": "high",
    "notes": "Diet-trap clarifying theme; attribute as speaker stance.",
    "collected_at": "2026-09-04"
  },
  {
    "id": "aq-sibo-yt-006",
    "paraphrase": "How do meal spacing and overnight fasting relate to preventing SIBO relapse?",
    "theme": "sibo",
    "source_type": "youtube_comment",
    "source_ref": "https://www.youtube.com/watch?v=UxQ48n_k28Q",
    "status": "clustered",
    "cluster_id": "sibo-drivers",
    "asset_coverage": ["pathway", "kit", "ap"],
    "priority": "medium",
    "notes": "MMC / stop-grazing counseling; AP stress-gut patterns.",
    "collected_at": "2026-09-04"
  },
  {
    "id": "aq-sibo-yt-007",
    "paraphrase": "Can stress alone bring SIBO symptoms back even after a good antimicrobial course?",
    "theme": "sibo",
    "source_type": "youtube_comment",
    "source_ref": "https://www.youtube.com/watch?v=SQPwHIzULfQ",
    "status": "clustered",
    "cluster_id": "sibo-drivers",
    "asset_coverage": ["pathway", "ap", "infographic"],
    "priority": "medium",
    "notes": "Strong AP LV invading SP / shen-gut window; biomed Phase 2 sympathetic drivers.",
    "collected_at": "2026-09-04"
  },
  {
    "id": "aq-sibo-yt-008",
    "paraphrase": "Why do some clinicians treat based on symptoms instead of waiting for a perfect breath test?",
    "theme": "sibo",
    "source_type": "youtube_comment",
    "source_ref": "https://www.youtube.com/watch?v=ObENBjKGm3g",
    "status": "clustered",
    "cluster_id": "sibo-breath-test",
    "asset_coverage": ["pathway", "kit"],
    "priority": "medium",
    "notes": "Hill clinical ± empiric preference; frame as speaker claim, not guideline.",
    "collected_at": "2026-09-04"
  }
]
