[
  {
    "id": "aq-sibo-paa-001",
    "paraphrase": "Why does SIBO keep coming back after treatment?",
    "theme": "sibo",
    "source_type": "paa",
    "source_ref": "SIBO relapse",
    "status": "clustered",
    "cluster_id": "sibo-relapse",
    "asset_coverage": ["pathway", "kit", "ap", "infographic"],
    "priority": "high",
    "notes": "Maps to Hill ~44% / 9 mo relapse framing and three-phase model.",
    "collected_at": "2026-09-04"
  },
  {
    "id": "aq-sibo-paa-002",
    "paraphrase": "How accurate is a SIBO breath test?",
    "theme": "sibo",
    "source_type": "paa",
    "source_ref": "SIBO breath test",
    "status": "clustered",
    "cluster_id": "sibo-breath-test",
    "asset_coverage": ["pathway", "kit"],
    "priority": "high",
    "notes": "Glucose ~54% / lactulose ~42% sensitivity as cited in pathway.",
    "collected_at": "2026-09-04"
  },
  {
    "id": "aq-sibo-paa-003",
    "paraphrase": "Can you have SIBO with a negative breath test?",
    "theme": "sibo",
    "source_type": "paa",
    "source_ref": "SIBO breath test negative",
    "status": "clustered",
    "cluster_id": "sibo-breath-test",
    "asset_coverage": ["pathway", "kit"],
    "priority": "high",
    "notes": "19-foot anatomy / distal miss teaching point.",
    "collected_at": "2026-09-04"
  },
  {
    "id": "aq-sibo-paa-004",
    "paraphrase": "Is a low-FODMAP diet the right diet for SIBO?",
    "theme": "sibo",
    "source_type": "paa",
    "source_ref": "SIBO diet FODMAP",
    "status": "clustered",
    "cluster_id": "sibo-diet",
    "asset_coverage": ["pathway", "kit"],
    "priority": "high",
    "notes": "Hill stance: FODMAP is IBS tool, not default SIBO diet.",
    "collected_at": "2026-09-04"
  },
  {
    "id": "aq-sibo-paa-005",
    "paraphrase": "What causes SIBO in the first place?",
    "theme": "sibo",
    "source_type": "paa",
    "source_ref": "SIBO causes",
    "status": "clustered",
    "cluster_id": "sibo-drivers",
    "asset_coverage": ["pathway", "kit", "ap"],
    "priority": "medium",
    "notes": "Secretions, motility/MMC, ICV, stress — Phase 2 terrain.",
    "collected_at": "2026-09-04"
  },
  {
    "id": "aq-sibo-paa-006",
    "paraphrase": "What are the main symptoms of SIBO?",
    "theme": "sibo",
    "source_type": "paa",
    "source_ref": "SIBO symptoms",
    "status": "clustered",
    "cluster_id": "sibo-basics",
    "asset_coverage": ["pathway", "kit"],
    "priority": "medium",
    "notes": "Entry criteria constellation; leave-level candidate.",
    "collected_at": "2026-09-04"
  },
  {
    "id": "aq-sibo-paa-007",
    "paraphrase": "How is SIBO different from IBS?",
    "theme": "sibo",
    "source_type": "paa",
    "source_ref": "SIBO vs IBS",
    "status": "clustered",
    "cluster_id": "sibo-basics",
    "asset_coverage": ["pathway", "kit"],
    "priority": "medium",
    "notes": "Pathway notes ~75% IBS overlap — related not identical.",
    "collected_at": "2026-09-04"
  },
  {
    "id": "aq-sibo-paa-008",
    "paraphrase": "Should SIBO and H. pylori be treated at the same time?",
    "theme": "sibo",
    "source_type": "paa",
    "source_ref": "SIBO H pylori",
    "status": "clustered",
    "cluster_id": "sibo-phase1",
    "asset_coverage": ["pathway", "kit"],
    "priority": "medium",
    "notes": "Speaker claim: treat together when both suspected.",
    "collected_at": "2026-09-04"
  },
  {
    "id": "aq-sibo-paa-009",
    "paraphrase": "Do probiotics help or hurt SIBO?",
    "theme": "sibo",
    "source_type": "paa",
    "source_ref": "SIBO probiotics",
    "status": "clustered",
    "cluster_id": "sibo-phase1",
    "asset_coverage": ["pathway", "kit"],
    "priority": "medium",
    "notes": "Hold until day 31; L. plantarum / S. boulardii framing.",
    "collected_at": "2026-09-04"
  },
  {
    "id": "aq-sibo-paa-010",
    "paraphrase": "How long should nutrient rebuilding take after SIBO treatment?",
    "theme": "sibo",
    "source_type": "paa",
    "source_ref": "SIBO nutrient deficiency",
    "status": "clustered",
    "cluster_id": "sibo-phase3",
    "asset_coverage": ["pathway", "kit", "ap"],
    "priority": "medium",
    "notes": "Phase 3 ≥6 months; AP tonify qi/blood window.",
    "collected_at": "2026-09-04"
  },
  {
    "id": "aq-sibo-paa-011",
    "paraphrase": "What is the migrating motor complex and how does it relate to SIBO?",
    "theme": "sibo",
    "source_type": "paa",
    "source_ref": "SIBO motility MMC",
    "status": "clustered",
    "cluster_id": "sibo-drivers",
    "asset_coverage": ["pathway", "kit", "ap"],
    "priority": "high",
    "notes": "Phase 2 + stop grazing; AP LV→SP / middle jiao.",
    "collected_at": "2026-09-04"
  },
  {
    "id": "aq-sibo-paa-012",
    "paraphrase": "What is IMO and how is it different from hydrogen SIBO?",
    "theme": "sibo",
    "source_type": "paa",
    "source_ref": "IMO vs SIBO",
    "status": "clustered",
    "cluster_id": "sibo-basics",
    "asset_coverage": ["pathway", "gap"],
    "priority": "low",
    "notes": "Pathway pearl only (B12 vs IMO); thin dedicated assets — partial gap.",
    "collected_at": "2026-09-04"
  }
]
